"مجال","العمر","المؤشر","الإجراء","المصدر"
"بناء الرابطة العاطفية بين الآباء والأبناء بالرفق","الفئة العمرية للأطفال من أربع إلى ست سنوات","الحاجة لتوجيه سلوك الطفل وتصحيح أخطائه بشكل يومي","توجيه الطفل نحو الطريق المستقيم بالرفق وتجنب العقاب المباشر","يجب أن نكون رؤساء بالرفق قبل العقاب لتوجيه أطفالنا"
"تعزيز التواصل اليومي الهادئ قبل موعد نوم الطفل","الفئة العمرية للأطفال من أربع إلى ست سنوات","الرغبة في معرفة مدى اقتراب الطفل واستعداده للحديث براحة","التحدث بصوت هادئ لمدة خمس دقائق يوميا دون أي توبيخ","اختر وقتا تتحدث فيه بصوت هادئ دون أن توبخه للطفل"
"مراقبة الوعي بنبرة الصوت وتأثيرها على استجابة الطفل","الفئة العمرية للأطفال من أربع إلى ست سنوات","ارتفاع نبرة الصوت بشكل غير مقصود أثناء محاولة التوجيه","مراقبة وتأمل تغير ملامح وجه الطفل عند تغيير نبرة الصوت","تأمل كيف تغير وجه طفلك عندما غيرت نبرة صوتك المرتفعة"
"أهمية الرحمة والاهتمام البالغ في عملية التكوين التربوي","الفئة العمرية للأطفال من أربع إلى ست سنوات","حاجة الطفل إلى الرعاية المستمرة لضمان حسن تكوينه ونموه","أن يكون الأهل قيادات تتعامل برحمة واهتمام لبناء شخصية الطفل","الأهل يرثون الرحمة ويحسنون تربية أبنائهم وتكوينهم بالاهتمام  والرفق"
"أساليب التعامل التربوي الإرشادي مع حالات فرط الحركة","الفئة العمرية للأطفال من أربع إلى ست سنوات","ظهور علامات فرط حركة خفيف يحتاج إلى تدخل إرشادي وتوجيه","فهم حالة فرط الحركة الخفيفة والتعامل معها بهدوء ورفق دائم","فهم والتعامل مع فرط حركة ضمن مستوى الشدة الخفيف للأطفال"
