"مجال","العمر","المؤشر","الإجراء","المصدر"
"التطور الحركي والجسدي للطفل الدارج","من سنتين إلى ثلاث سنوات","يركض ويركل الكرة ويصعد بضع درجات","تشجيع اللعب الحركي والتفاعلي بشكل مستمر","من الطبيعي أن يركض ويركل الكرة"
"التطور اللغوي ومهارات التواصل للطفل","من سنتين إلى ثلاث سنوات","التعبير عن نفسه بجمل من كلمتين","دعم الطفل بالحديث المستمر معه يوميا","يعبر عن نفسه بجمل من كلمتين"
"الفحص الطبي الشامل والمتابعة الدورية","من سنتين إلى ثلاث سنوات","بلوغ الطفل عامين ومتابعة تطوره الطبيعي","طلب الفحص التطوري الشامل وفحص التوحد","لا تنس طلب الفحص التطوري الشامل"
"التدريب على استخدام المرحاض والاعتماد الذاتي","من سنتين إلى ثلاث سنوات","الاستعداد لتعلم استخدام المرحاض وقضاء الحاجة","تعليمه الاستنجاء والدخول باليسرى والخروج باليمنى","دربيه على دخول الحمام بالرجل اليسرى"
"الآداب الإسلامية والدعاء عند قضاء الحاجة","من سنتين إلى ثلاث سنوات","البدء بتعليم الآداب الصحيحة لاستخدام المرحاض","تحفيظ الطفل دعاء الدخول والخروج للحمام","حفظ دعاء الدخول والخروج لترسيخ الآداب"
"التعامل مع فرط الحركة وتوجيه السلوك","من سنتين إلى ثلاث سنوات","الحاجة لتوجيه السلوك واللعب مع الأصدقاء","قراءة الكتب والمساعدة بالأشياء البسيطة يوميا","تشجيعهم على اللعب مع أصدقائهم والتحدث إليهم"
