"مجال","العمر","المؤشر","الإجراء","المصدر"
"اضطراب النوم","7-9 سنوات","صعوبة الطفل في الاستغراق في النوم ليلا","وضع جدول زمني ثابت واستغراق بنشاط خفيف","يمكن تجربة وضع جدول زمني ثابت للنوم"
"الاضطرابات النفسية","7-9 سنوات","أعراض القلق والاكتئاب تستمر لبضعة أسابيع","التحقق من الطفل ومتابعة أدائه الدراسي","يجب التحقق من الأطفال الذين يعانون من هذه الأعراض"
"فرط الحركة والتشتت","7-9 سنوات","كثرة المشتتات أثناء أداء الواجبات المدرسية","تقسيم المهمة لخطوات ومكافأة السلوك الجيد","نظام يومي ثابت، تعليمات قصيرة وتقسيم المهمة"
"الصحة النفسية والخطورة","7-9 سنوات","ظهور سلوك خطر أو الرغبة بإيذاء النفس","الاستعانة بطبيب مختص فوراً لتقييم الحالة","يجب الاستعانة بطبيب فوراً إذا كان السلوك خطراً"
"الدعم والوقاية","7-9 سنوات","معاناة الطفل من التوتر والقلق المستمر","تقديم الدعم المستمر للطفل لتقليل التوتر","دعم الأطفال لمنع حدوث اضطرابات نفسية في الكبر"
"قضم الأظافر","7-9 سنوات","حدوث تلف في الجلد مع احمرار وانتفاخ","مراقبة الطفل وتوفير أشياء آمنة كبديل","يجب مراقبة الطفل وإعطاءه أشياء آمنة للاستفادة منها"
