"مجال","العمر","المؤشر","الإجراء","المصدر"
"بناء العقيدة الإسلامية في سن مبكرة","من مرحلة الولادة حتى ثلاث سنوات","استيعاب الطفل للبيئة والتكرار اليومي حوله","توفير بيئة مليئة بذكر الله لتكون قدوة للطفل","العقيدة لا تعلم بالمحاضرات بل بالبيئة والتكرار والقدوة"
"دمج الأذكار في الروتين اليومي للطفل","من مرحلة الولادة حتى ثلاث سنوات","عند تغيير الملابس أو الرضاعة أو الاستحمام","قول كلمة بسم الله بصوت مسموع عند كل تغيير","هذا التكرار يبني مفردات إيمانية في عقله قبل معانيها"
"تأسيس روتين الاستيقاظ الصباحي للطفل يوميا","من مرحلة الولادة حتى ثلاث سنوات","استيقاظ الطفل من نومه في كل صباح","قول دعاء الاستيقاظ من النوم بصوت مسموع دائما","دعه يسمع هذا الروتين يوميا لترسيخ المفردات الإيمانية"
"ربط الفرح ورؤية الجمال بذكر الله","من مرحلة الولادة حتى ثلاث سنوات","رؤية طفلك لشيء جميل مثل القمر أو الفراشة","قل ماشاء الله بصوت مسموع وأشر بيدك للشيء","الطفل يربط الفرح بالله وتترسخ المفردات في وجدانه"
"التطور الوجداني والعاطفي وربطه بالجانب الإيماني","من مرحلة الولادة حتى ثلاث سنوات","تفاعل الطفل عاطفيا والشعور بالسعادة في يومه","ربط الأشياء الجميلة والمفرحة دائما بذكر اسم الله","يجعل الإيمان راسخا في الوجدان قبل إدراك العقل"
