"مجال","العمر","المؤشر","الإجراء","المصدر"
"فهم سلوكيات الطفل ومستوى نشاطه اليومي","الأطفال في الفئة العمرية بين أربع وست سنوات","ملاحظة فرط الحركة لدى الطفل بمستوى شدة متوسط","فهم الحالة جيداً والتعامل مع فرط حركة الطفل","الهدف هو فهم والتعامل مع فرط حركة الطفل"
"الالتزام بالقواعد واللعب التعاوني مع الآخرين","الأطفال في الفئة العمرية بين أربع وست سنوات","تفاعل الطفل أثناء ممارسة الألعاب مع أقرانه","توجيه الطفل ليكون متعاوناً ويلتزم بقواعد اللعب","يجب على الطفل أن يلتزم بالقواعد ويكون متعاونًا"
"التحلي بالأخلاق الحميدة مثل الصبر والاحترام","الأطفال في الفئة العمرية بين أربع وست سنوات","طريقة تعامل الطفل مع المواقف التي تتطلب الانتظار","تدريب الطفل على التحلي بالصبر والاحترام بشكل دائم","يجب عليه أيضًا التحلي بالصبر والاحترام مع الآخرين"
"بناء الحوار اليومي الفعال قبل وقت النوم","الأطفال في الفئة العمرية بين أربع وست سنوات","اقتراب وقت النوم المعتاد كل ليلة للطفل","طرح ثلاثة أسئلة محددة من القائمة على الطفل","كل ليلة قبل النوم اسأل طفلك ثلاثة أسئلة"
"التعبير عن المشاعر السلبية والإيجابية ومناقشتها","الأطفال في الفئة العمرية بين أربع وست سنوات","شعور الطفل بالحزن أو رغبته الشديدة في البكاء","سؤاله عما فعله عندما شعر بالرغبة في البكاء","ماذا فعلت حين أردت أن تبكي في يومك"
"تأمل استجابات الطفل ومراقبة تطور مهارات الحوار","الأطفال في الفئة العمرية بين أربع وست سنوات","بدء الطفل بطرح أسئلة مماثلة لأسئلة والديه","ملاحظة الأسئلة التي تثير إجابات عميقة لدى الطفل","هل لاحظت أن طفلك بدأ يطرح أسئلة مماثلة"
