"مجال","العمر","المؤشر","الإجراء","المصدر"
"تنمية قيمة الرفق في التعامل التربوي","الأطفال في المرحلة العمرية 4-6 سنوات","ظهور حاجة الطفل للتوجيه السليم والمستقيم","استخدام الرفق في التوجيه قبل اللجوء للعقاب","يجب أن نكون رؤساء بالرفق قبل العقاب"
"التعامل مع حالات فرط الحركة الخفيفة","الأطفال في المرحلة العمرية 4-6 سنوات","زيادة حركة ونشاط الطفل في حياته اليومية","تفهم سلوك الطفل وإرشاده بهدوء ورفق بالغ","فهم والتعامل مع فرط حركة الأطفال الخفيفة"
"تحسين التواصل اليومي والتحدث الهادئ المباشر","الأطفال في المرحلة العمرية 4-6 سنوات","ملاحظة انكماش أو ابتعاد الطفل عن والديه","التحدث بصوت هادئ لمدة خمس دقائق يوميا","اختر وقتا يوميا تتحدث فيه بصوت هادئ"
"أساليب التوجيه التربوي السليم والمراقبة الذاتية","الأطفال في المرحلة العمرية 4-6 سنوات","ارتفاع صوت الوالدين بالخطأ أثناء تقديم التوجيه","مراقبة نبرة الصوت وخفضها للتشجيع على الاقتراب","خفض الصوت يغير وجه وجسد الطفل للاقتراب"
"المراقبة والاستماع الفعال لحديث الطفل اليومي","الأطفال في المرحلة العمرية 4-6 سنوات","زيادة رغبة الطفل في الحديث والتقرب للوالدين","الاستماع للطفل قبل النوم دون تقديم توجيهات","تحدث دون أي توجيه ولاحظ استجابة طفلك"
